{
  "schema_version": "voice-agent.slice2-llm-parallel.v1",
  "origin": "Freshly authored synthetic Russian concurrency workload dedicated as CC0-1.0; markers and topics contain no private or conversational material.",
  "levels": [1, 2, 4],
  "rounds": 3,
  "maximum_output_tokens": 256,
  "context_pressure": {
    "enabled": true,
    "maximum_input_tokens": 3584,
    "construction": "For the separate KV-cache pressure pass, repeat the public prompt text in request order and retain the largest tokenizer prefix not exceeding 3584 input tokens; generate up to 256 tokens so every request remains within the 4096-token server limit."
  },
  "requests": [
    {"id": "parallel-01", "marker": "ПАРУС-01", "prompt": "Начни и закончи ответ меткой ПАРУС-01. Между метками дай ровно шесть коротких советов по уходу за комнатными растениями."},
    {"id": "parallel-02", "marker": "ПАРУС-02", "prompt": "Начни и закончи ответ меткой ПАРУС-02. Между метками дай ровно шесть коротких советов по организации рабочего стола."},
    {"id": "parallel-03", "marker": "ПАРУС-03", "prompt": "Начни и закончи ответ меткой ПАРУС-03. Между метками дай ровно шесть коротких идей для спокойной прогулки по городу."},
    {"id": "parallel-04", "marker": "ПАРУС-04", "prompt": "Начни и закончи ответ меткой ПАРУС-04. Между метками дай ровно шесть коротких правил бережного хранения книг."},
    {"id": "parallel-05", "marker": "ПАРУС-05", "prompt": "Начни и закончи ответ меткой ПАРУС-05. Между метками дай ровно шесть коротких способов подготовиться ко сну."},
    {"id": "parallel-06", "marker": "ПАРУС-06", "prompt": "Начни и закончи ответ меткой ПАРУС-06. Между метками дай ровно шесть коротких идей для простого завтрака."},
    {"id": "parallel-07", "marker": "ПАРУС-07", "prompt": "Начни и закончи ответ меткой ПАРУС-07. Между метками дай ровно шесть коротких советов по планированию поездки на поезде."},
    {"id": "parallel-08", "marker": "ПАРУС-08", "prompt": "Начни и закончи ответ меткой ПАРУС-08. Между метками дай ровно шесть коротких способов поддерживать порядок в рюкзаке."},
    {"id": "parallel-09", "marker": "ПАРУС-09", "prompt": "Начни и закончи ответ меткой ПАРУС-09. Между метками дай ровно шесть коротких советов по безопасной прогулке в дождь."},
    {"id": "parallel-10", "marker": "ПАРУС-10", "prompt": "Начни и закончи ответ меткой ПАРУС-10. Между метками дай ровно шесть коротких идей для семейного вечера без экранов."},
    {"id": "parallel-11", "marker": "ПАРУС-11", "prompt": "Начни и закончи ответ меткой ПАРУС-11. Между метками дай ровно шесть коротких способов экономить воду дома."},
    {"id": "parallel-12", "marker": "ПАРУС-12", "prompt": "Начни и закончи ответ меткой ПАРУС-12. Между метками дай ровно шесть коротких советов по подготовке к холодной погоде."}
  ]
}
